authors,authors_verbatim,title,journal,year,citation,abstract,independent_variables,independent_variables_verbatim,dependent_variables,dependent_variables_verbatim,survey_questions,incentive,incentive_verbatim,study_type,study_type_verbatim,analysis_equations,analysis_equations_verbatim,level_of_analysis,level_of_analysis_verbatim,main_effects,main_effects_verbatim,statistical_power,statistical_power_verbatim,moderators,moderators_verbatim,moderation_results,moderation_results_verbatim,demographics,demographics_verbatim,recruitment_source,recruitment_source_verbatim,sample_size,sample_size_verbatim,country_region,sociocultural_context,political_context,platform_technological_context,temporal_context,recommended_moderators,research_context,intervention_insights,,,,,,,,,,,,,
"Nejla Asimovic, Jonathan Nagler, Richard Bonneau, and Joshua A. Tucker","Nejla Asimovica,b,1, Jonathan Naglera,b, Richard Bonneaub,c,d, and Joshua A. Tuckera,b,e",Testing the effects of Facebook usage in an ethnically polarized setting,PNAS,2021,"Asimovic, N., Nagler, J., Bonneau, R., & Tucker, J. A. (2021). Testing the effects of Facebook usage in an ethnically polarized setting. Proceedings of the National Academy of Sciences, 118(25), e2022819118.","Despite the belief that social media is altering intergroup dynamics—bringing people closer or further alienating them from one another—the impact of social media on interethnic attitudes has yet to be rigorously evaluated, especially within areas with tenuous interethnic relations. We report results from a randomized controlled trial in Bosnia and Herzegovina (BiH), exploring the effects of exposure to social media during 1 wk around genocide remembrance in July 2019 on a set of interethnic attitudes of Facebook users. We find evidence that, counter to preregistered expectations, people who deactivated their Facebook profiles report lower regard for ethnic outgroups than those who remained active. Moreover, we present additional evidence suggesting that this effect is likely conditional on the level of ethnic heterogeneity of respondents’ residence. We also extend the analysis to include measures of subjective well-being and knowledge of news. Here, we find that Facebook deactivation leads to suggestive improvements in subjective wellbeing and a decrease in knowledge of current events, replicating results from recent research in the United States in a very different context, thus increasing our confidence in the generalizability of these effects.",Deactivation from Facebook for one week (treatment) vs. continued normal Facebook use (control).,"Our treatment of Facebook deactivation took place from 7 July until 14 July 2019, encompassing the week around the Remembrance Day (11 July) of the genocide in Srebrenica. The genocide in Srebrenica is central and deeply intertwined with the memory of the Bosnian war as the worst atrocity in Europe after World War II. Online and offline discussions related to the war are held to a certain extent throughout the year, but significantly intensify during this period.","Interethnic regard (composite index and components), 
subjective well-being (index and components), 
news knowledge (index and items), 
political disaffection (secondary).","Participants took a comprehensive survey at the end of the experiment, and we focus on questions within three families of outcomes: outgroup regard, subjective wellbeing, and news knowledge (full list of questions in SI Appendix, Table S4). All of the questions were preregistered; following our preanalysis plan, we present results both for the composite indexes and for each of their corresponding indicators.","Outcome: Out-Group Ratings

Q: To understand the situation in BiH, we are interested in your opinion about the constituent people in BiH and the relationship between different groups. For each characteristic, please indicate how well you think it applies to members of the two ethnic groups different than the one you identify yourself with. Measurements: Traits: Intelligent; Honest; Patriotic; Open-minded; Generous; Hypocritical; Selfish; Mean; Unreliable 

Options: [Not at all; Not too well; Somewhat well; Very well; Extremely well] 

Outcome: In-Group Trait Ratings 

Q: How do you think members of the other two main ethnic groups in BiH would evaluate members of your ethnic group in terms of these same trait ratings? Measurements: Traits: Intelligent; Honest; Patriotic; Open-minded; Generous; Hypocritical; Selfish; Mean; Unreliable 

Options: [Not at all; Not too well; Somewhat well; Very well; Extremely well] 

Outcome: Out-Group Feeling Thermometer 

Q: Academically-run national surveys in the United States often use something we call the feeling thermometer to understand how people feel about different individuals and groups. The question about feelings between groups has been included in every American National Election Studies since 1968. Given that there are different ethnic groups living in BiH, we'd like you to rate the groups in the following way: Indicate on a 101-point scale how warm you feel towards the members of the other ethnic groups in BiH. Ratings between 50 degrees and 100 degrees mean that you feel favorable and warm toward the group. Ratings between 0 degrees and 50 degrees mean that you do not feel favorable toward the group, and you would select the 50 degree mark if you have no feelings one way or the other. 

Options: Survey slider (0-100) 

Outcome: In-Group Feeling Thermometer

Q: Indicate on a 101-point scale how warm you feel towards the members of the ethnic group you identify with. Measurements: Survey slider (0-100) 

Outcome: Social Distance 

Q: People tend to be willing to participate in social contacts of varying degrees of closeness with members of diverse social groups, such as racial and ethnic groups. Please consider and share whether you would be willing to: 1. Marry a member of the other group? 2. Have a member of the other group as your close personal friend? 3. Have a member of the other group as your neighbor? 4. Have a member of the other group as your colleague at work? 5. Have more members of the other group as citizens of your country? 6. Have more members of the other group as non-citizen visitors? 7. Have members of the other group be excluded from associating with your country in any way? 

Options: Not willing; Not really willing; Undecided; Somewhat willing; Willing 

*In the final survey, rather than providing a Likert scale for each response, we asked participants to indicate all the ways in which they would be willing to engage with the outgroup from the indicated seven options. Hence, our composite social distance indicator goes from 1-7, capturing the least to the highest level of willingness to be socially close. 

Outcome: Cooperation 

Q: Please indicate your agreement with the following statements: 1. Multi-ethnic parties cannot secure the interests of my people. 2. It is possible to cooperate only with people of my ethnic group. 

Options: 1.Absolutely agree; 3. No opinion; 6. Strongly disagree 

Outcome: Subjective Well-Being 

Q: Please indicate how well you agree with the following statements. How often did you feel the following over the last week: Satisfaction with life, Depression, Loneliness, Anxiety, Boredom, Joy, Isolation, Fulfillment Measurements: 

Options: Never, Rarely, Sometimes, Often, Always 

Outcome: Political News Knowledge 

Q: We present you few headlines, few of which truly appeared in the news over the last few days and few of which are false [added by our team]. Please indicate your belief that the following appeared in the news: 8 news summary headlines [4 political and 4 non-political]: T: South-East European Cooperation Process (SEECP) summit began in Bosnia- Herzegovina this week. F: Thirteen bh. political officials sued for corruption; hearings scheduled to start in September. T: Amel Tuka won the 3rd Place in the Final Race of the Diamond League. F: Opening ceremony of Europe Youth U18 and U16 Basketball Cup began in Sarajevo yesterday; matches planned in four bh. cities! T: Turkish President Recep Tayyip Erdogan arrived to BiH on Monday. F: Head of the EU Delegation to Ukraine Hugues Mingarelli started his visit to Bosnia- Herzegovina, with a full week of meetings ahead of him. T: An aluminum smelter based in Bosnia closes its doors due to bankruptcy. F: An earthquake of magnitude of 3.1 degrees Richter scale hits eastern part of the country. 

Options: True, Not Sure, Untrue",20 BAM (≈ $11.45) in mobile credit.,"The text above the ad stated the following “Take part in an academic study about the effects of social media on users! Share your thoughts, help the accumulation of knowledge, and win 20KM.” (Fig. S1.b, below), while the ad image indicated that 20BAM (equivalent of $11.45, as of July 2019) in mobile credit awaits for all study participants.",Randomized controlled trial / Experimental field study.,"We report results from a randomized controlled trial in Bosnia and Herzegovina (BiH), exploring the effects of exposure to social media during 1 wk around genocide remembrance in July 2019 on a set of interethnic attitudes of Facebook users.","The study estimates the intent-to-treat (ITT) effect using an OLS regression model: Yi = α + βTi + θXi + εi. In this model, Yi is the outcome for individual i. T is a binary indicator for treatment assignment (1 if assigned to Facebook deactivation, 0 if control). X is a vector of individual-level pre-treatment covariates, including gender, age, employment status, ethnicity, weekly frequency of Facebook usage, and the perceived importance of country and ethnic membership. To improve consistency, some specifications include mean-centered covariates interacted with the treatment indicator.","With the following regression, we estimate the intent-to-treat effect of Facebook deactivation on our outcomes of interest: Yi = α + βTi + θXi + εi, [1] where Yi is an outcome, T = {0,1} an indicator of treatment assignment, and X, a vector of covariates for the individual. Full covariate specification includes the following controls captured in the pretreatment survey: gender, age, employment status, ethnicity, weekly frequency of Facebook usage, and the perceived importance of country and ethnic membership to one’s identity. When incorporating covariates and in an effort to improve consistency of the estimated effect, we include mean-centered covariates and interact them with the treatment indicator (47, 48).",Individual participant.,"In both cases, the characteristics of those who attritted after being assigned to deactivate versus those who attritted after being assigned to remain active are largely balanced. We also estimate the probability of attrition for each user and show that our findings are robust to the inclusion of this control in our key models. This strengthens our belief that, although more people attrit within the treatment group, they do so for reasons largely unrelated to our outcomes of interest, which limits the potential of attrition biasing the internal validity of our results.","Main effects are reported as standardized coefficients (relative to the control group's standard deviation). News Knowledge Index: β = -0.27 SD, SE = 0.106, P < 0.05 Subjective Wellbeing Index: β = 0.177 SD, SE = 0.105, P < 0.10 (marginally significant) Anxiety (part of wellbeing): β = -0.37 SD, SE = 0.108, P < 0.01 (a decrease in anxiety) Loneliness (part of wellbeing): β = -0.20 SD, SE = 0.107, P < 0.10 (a decrease in loneliness) Outgroup Regard Index (principal component): β = -0.24 SD, SE = 0.105, P < 0.05 Feeling Thermometer toward outgroup: β = -0.24 SD, SE = 0.105, P < 0.05 Cooperation with outgroup: β = -0.21 SD, SE = 0.112, P < 0.10 Political Disaffection Index: β = 0.401, SE = 0.108, p < 0.01 (increase in disaffection)","Main Effects on Subjective Wellbeing and News Knowledge. We test our news knowledge variable by creating an eight-item knowledge quiz with news headlines... What we find is that Facebook deactivation significantly reduced news knowledge, with treatment leading to a reduction of news knowledge by 0.27 SD (SE = 0.106; P < 0.05) (Fig. 1A). ... With regard to subjective wellbeing (Fig 1A and SI Appendix, Table S5), we detect statistically significant effects on levels of anxiety (intention to treat [ITT]: β = −0.37 SD, SE = 0.108, P < 0.01) and loneliness (ITT: β = −0.20 SD, SE = 0.107, P < 0.10). ... The effect estimate on the index of subjective wellbeing, created as a sum of z scores, yields a marginally significant effect size of 0.18 SD (SE = 0.105, P < 0.10, as shown in SI Appendix, Table S5). Main Effects on Interethnic Regard. Analyzing the impact of the treatment on interethnic attitudes, we find that deactivation from Facebook led to more negative rather than positive outgroup attitudes, the opposite of what we initially hypothesized. ... However, we find that deactivation reduced the reported willingness to cooperate with the outgroup by 0.21 SD (SE = 0.112, P < 0.10), while significantly reducing the feeling thermometer score by 0.24 SD (SE = 0.105, P < 0.05), controlling for randomization block and a rich set of baseline covariates. ... With a principal component index of outgroup regard, we find that deactivation significantly reduced reported levels of outgroup regard by 0.24 SD (SE = 0.105, P < 0.05).",The paper states that the study is underpowered for the exploration of heterogeneous treatment effects. No a priori power analysis is reported for the main effects.,Such replications could also allow for a more robust exploration of heterogeneous treatment effects for which this study is underpowered.,"Offline ethnic heterogeneity of residence (fractionalization, majority share, Shannon diversity); difference between offline and online network diversity; exploratory subgroups: age, gender, interest in politics, ethnicity, entity of residence.","Moreover, we present additional evidence suggesting that this effect is likely conditional on the level of ethnic heterogeneity of respondents’ residence. ... To explore whether this implication holds in the context of our study, we performed a series of analyses that were not explicitly part of our original preregistration and thus should be interpreted with that caveat in mind. To proxy for users’ offline networks, we use the latest Bosnia and Herzegovina census data (2013) on ethnic heterogeneities of BiH localities.","Test/Interaction: Treatment effect on outgroup regard moderated by offline ethnic heterogeneity of residence. Result: The negative effect of Facebook deactivation on outgroup regard was found almost exclusively among participants living in more ethnically homogeneous communities. In the subsample of users from homogeneous towns, the effect on the outgroup regard index was negative and statistically significant (e.g., for ethnic fractionalization measure, β=-0.429***, SE=0.151). For participants in more heterogeneous communities, there was no statistically significant effect. Test/Interaction: Treatment effect on outgroup regard moderated by the difference between offline and online network diversity. Result: Deactivating from Facebook had a significantly more negative effect on outgroup attitudes for users whose online networks were more diverse than their offline networks. For example, the interaction effect between treatment and a binary indicator for (offline more homogeneous than online) was significant and negative (β=-0.679**, SE=0.329, using the Shannon Entropy index).","Within the subsample of more homogeneous towns, the effect of deactivation on the composite index of outgroup regard is negative and highly statistically significant (SI Appendix, Tables S10–S12); on the contrary, for people living in more heterogeneous offline environments, there is no effect of deactivation on outgroup attitudes. Hence, it appears that the negative effect of Facebook deactivation on outgroup regard is almost entirely driven by users within the communities in which the opportunities for offline intergroup contact are limited (and in some cases possibly nonexistent), and they therefore may be living within offline echo chambers that are stronger than the ones users find online. ... Across all three methods of measuring diversity, the estimate on outgroup regard passes the Benjamini-Hochberg multiple-comparisons correction at the 0.05 level (SI Appendix, Tables S13–15).","Age: mean age 29.2 years (SD = 8.96).

Gender: mean of 1.640 on a scale where 1=male, 2=female, and 0=other/prefer not to say, suggesting a majority of female participants. 

Education: The mean education level was 3.01 (SD = 1.11) on a 0-5 scale, where 5 represents a Master's/PhD degree. 

Employment Status: 41.4% of the sample was employed. 

Race/Ethnicity: The sample consisted of 58.92% Bosniaks, 16.71% Serbs, 6.52% Croats, 13.03% identified as Bosnian, and 4.82% identified as other or chose not to say.","Table S2. Ethnic composition of the sample, as self-reported in the pre-treatment survey. Numbers also include those who identified themselves by their religion (matching the ethnic category with the religion most frequently associated with members of that category). Ethnic Group, No. of people, Share Bosniak, 208, 58.92 % Serb, 59, 16.71 % Croat, 23, 6.52 % Bosnian (supraordinate identity), 46, 13.03 % Other or Do not want to say, 17, 4.82 % Table S1. Descriptive statistics of the overall sample... Variable, Mean (SD) Age, 29.200 (8.960) Gender, 1.640 (0.493) Education, 3.010 (1.110) Employment, 0.414 (0.493)",Recruited through Facebook advertisements.,"Participants were recruited through Facebook advertisements, which we ran across BiH (SI Appendix, Fig. S1B) in both Cyrillic and Latin alphabets.","Randomized: 556; analyzed endline: 353 (159 treatment, 194 control).","We block randomized the 556 resulting individuals into treatment and control, blocking on the variable from the baseline survey that measures the importance of ethnic identity to one’s self-identification. A total of 258 of individuals assigned to the control group and 263 of those assigned to the treatment group were successfully emailed. ... We received endline surveys from 159 participants in the treatment group and 194 participants in the control group, with their observable characteristics balanced between the treatment and the control group (SI Appendix, Table S3).",Bosnia and Herzegovina (BiH),"Post-conflict, highly ethnically polarized/segregated society; no language barrier among main groups.","Ethnonationalism dominates; timed around Srebrenica genocide remembrance (July 11), a period of elevated identity salience and political discourse.",Facebook only; dominant platform in BiH (~99% share at the time); intervention = account deactivation.,"July 7–14, 2019; week around Srebrenica remembrance.",Larger-scale replications to examine heterogeneous effects; compare diversity of online vs. offline networks more directly.,"Emotionally/politically charged remembrance period; online content likely “particularly emotional and distressing,” possibly amplifying effects (e.g., larger anxiety decrease).","Deactivation is not a universal remedy for ethnic polarization; in segregated contexts, Facebook may provide rare exposure to outgroups—removing it without substitutes can worsen outgroup attitudes. Policies should consider what replaces online contact and the surrounding social ecosystem.",,,,,,,,,,,,,
