authors,authors_verbatim,title,journal,year,citation,abstract,independent_variables,independent_variables_verbatim,dependent_variables,dependent_variables_verbatim,survey_questions,incentive,incentive_verbatim,study_type,study_type_verbatim,analysis_equations,analysis_equations_verbatim,level_of_analysis,level_of_analysis_verbatim,main_effects,main_effects_verbatim,statistical_power,statistical_power_verbatim,moderators,moderators_verbatim,moderation_results,moderation_results_verbatim,demographics,demographics_verbatim,recruitment_source,recruitment_source_verbatim,sample_size,sample_size_verbatim,country_region,sociocultural_context,political_context,platform_technological_context,temporal_context,recommended_moderators,research_context,intervention_insights,,,,,,,,,,,,,
"William J. Brady, Killian L. McLoughlin, Mark P. Torres, Kara F. Luo, Maria Gendron & M. J. Crockett","William J. Brady1,2, Killian L. McLoughlin2,3,4, Mark P. Torres5, Kara F. Luo2, Maria Gendron2 & M. J. Crockett2,3,6",Overperception of moral outrage in online social networks inflates beliefs about intergroup hostility,Nature Human Behaviour,2023,"Brady, W. J., McLoughlin, K. L., Torres, M. P., Luo, K. F., Gendron, M., & Crockett, M. J. (2023). Overperception of moral outrage in online social networks inflates beliefs about intergroup hostility. *Nature Human Behaviour*, *7*(6), 917–927.","As individuals and political leaders increasingly interact in online social networks, it is important to understand the dynamics of emotion perception online. Here, we propose that social media users overperceive levels of moral outrage felt by individuals and groups, inflating beliefs about intergroup hostility. Using a Twitter field survey, we measured authors' moral outrage in real time and compared authors' reports to observers' judgements of the authors' moral outrage. We find that observers systematically overperceive moral outrage in authors, inferring more intense moral outrage experiences from messages than the authors of those messages actually reported. This effect was stronger in participants who spent more time on social media to learn about politics. Preregistered confirmatory behavioural experiments found that overperception of individuals' moral outrage causes overperception of collective moral outrage and inflates beliefs about hostile communication norms, group affective polarization and ideological extremity. Together, these results highlight how individual-level overperceptions of online moral outrage produce collective overperceptions that have the potential to warp our social knowledge of moral and political attitudes.","The emotion rating (author self-report vs. independent observer judgment), 
experimentally manipulated content of a simulated Twitter newsfeed. ","For these experiments, we leveraged the database of author tweets that we gathered in studies 1 and 2 to create simulated Twitter newsfeeds. For each tweet in our database, we had access to the author’s self-reported outrage, as well as the mean of at least ten observers’ judgements of outrage (Fig. 4a). These pairs of author self-reports and observer mean judgements enabled us to construct two sets of tweets: ‘high-overperception’ tweets where the observers reported notably more outrage than the authors reported and ‘low-overperception’ tweets, where the observers’ judged outrage and authors’ self-report were within 1.5 scale points on average (Methods). From these tweets, we constructed two simulated Twitter newsfeeds: a high-overperception newsfeed composed of highly overperceived tweets and a low-overperception newsfeed composed of less over-perceived tweets. Crucially, these feeds were matched in the level of outrage self-reported by tweet authors (Fig. 4b).","Perceived moral outrage; 
Perceived happiness; 
Perceived collective moral outrage; 
Perceptions of outrage expression norms; 
Affective polarization; 
Perceived ideological extremity.","For our main analysis, we tested whether observers tended to overperceive authors’ moral outrage. [we] did not observe overperception of happiness Study 4 tested whether the overperception of individuals’ outrage that we discovered in studies 1–3 amplifies perceptions of collective moral outrage. To examine perceptions of outrage norms, after viewing the simulated newsfeed, participants completed a norm judgement task Next, we investigated whether overperception of outrage inflates beliefs about affective polarization. Lastly, we asked participants in both newsfeed conditions to judge how ideologically extreme people in the social network were.","Outcome: Moral Outrage (Author Self-Report & Observer Judgment) 

Q: How outraged did you feel on a 1-7 scale? 

Options: (1 = not at all, 4 = somewhat, 7 = very) 

Outcome: Happiness (Author Self-Report & Observer Judgment) 

Q: How happy did you feel on a 1-7 scale? 

Options: (1 = not at all, 4 = somewhat, 7 = very) 

Outcome: Collective Moral Outrage (Study 4)

Q: How morally outraged do you think the members of this social network are? 

Options: 1 (not at all outraged) to 7 (very outraged) Likert scale 

Outcome: Perceptions of outrage norms (Study 5) 

Q: How socially appropriate/inappropriate would it be for someone to post this tweet to the social media network that sent the messages you recently viewed?

Options: -3 (very socially inappropriate) to 3 (very socially appropriate) scale 

Outcome: Affective polarization (Study 5) 

Q: On average how do you think the people in this network feel about Republicans (Democrats)? 

Options: 0-100 feeling thermometer scale 

Outcome: Ideological extremity (Study 5)  

Q: What do you think the political ideology of the typical person in the network is? 

Options: -3 (extremely liberal) to 3 (extremely conservative) scale 

Outcome: Political social media use (Studies 1-3) 

[participants were asked to] report whether they used social media daily to learn about politics and then to report the number of times they do so daily on a 0–100 sliding scale",specific amount paid to participants is not specified. ,"Our experiments use partisan social media users recruited from Prolific.ac. ... We chose the Prolific platform because it tends to have better data quality (e.g., higher response rates and comprehension checks) than MTurk and enforces better pay standards.","Studies 1-3: Twitter field studies, combining observational and survey methods. 

Studies 4-5: Preregistered confirmatory behavioural experiments with random assignment.","To test for overperception of outrage and its consequences for intergroup outcomes, we developed a methodology that allowed us to measure the outrage felt by social media users when they posted a message and then compare it to observer judgements of the authors’ outrage. Across three field studies, we find evidence for systematic overperception of individuals’ outrage on Twitter; namely, that observers perceive more outrage than is reported by authors. In a preregistered confirmatory experiment using a simulated Twitter newsfeed, we manipulated overperception of individuals’ outrage and found that when participants view a newsfeed containing outrage expressions that tend to be overperceived, it causes perceptions of collective outrage of the social network to increase. A second preregistered experiment found that viewing overperceived outrage messages also amplified participants' beliefs about (1) norms of outrage expression, (2) affective polarization and (3) ideological extremity present in the network.","The main analyses in Studies 1-3 used a multilevel model to test for overperception. The model predicted outrage/happiness ratings from a dummy-coded 'source' variable (author vs. observer). The model included random intercepts for tweet ID and observer ID to account for non-independence of observations. 

The structure was: Rating ~ Source + (1|Tweet_ID) + (1|Observer_ID). Other analyses used Pearson correlations to test for associations (e.g., between overperception and social media use), independent-samples t-tests to compare means between experimental conditions (Studies 4 and 5), and a two-way ANOVA to test for an interaction effect for the affective polarization outcome in Study 5.","To test whether observers were overperceiving the outrage/happiness in authors’ tweets, we used a generalized linear model with judgements of outrage/happiness clustered by observer (every observer judged 15 authors/tweets) and author id and tweet id entered as random factors. Fixed effects estimated the difference in outrage values between authors and observers. For the main analyses, overperception of outrage and happiness were tested in two separate models but see Supplementary Section 1.2 for a model fit using both emotion judgements. We used the lmer function in the lme4 package in R v.3.4.3. All data and analysis scripts are available at https://osf.io/gtwsk/. ... To test for differences in judgements of collective outrage between groups, we conducted an independent-samples t-test adjusting for unequal variances. To test the predictions of the simple average versus weighted average models of social learning, a one-sample t-test was conducted to compare the collective outrage judgement mean against the mean of outrage perceived in each newsfeed message when viewed individually (a message’s ‘individually perceived outrage’ value).","Individual participant;
 individual tweet","We conducted a multilevel model that included random effects of target (tweet) and observer. In the model, source (author versus observer) was entered as a dummy-coded predictor variable and tweet id and observer id and were entered as the clustering variables.","Overperception of Outrage (Author vs. Observer):

Study 1: slope coefficient (b) = 0.59, P = 0.011, 95% confidence interval (CI) = (0.14, 1.04) 

Study 2: b = 0.58, P = 0.001, 95% CI = (0.25, 0.92) Study 3: b = 0.62, P < 0.001, 95% CI = (0.27, 0.93) 

Perception of Happiness (Author vs. Observer): 

Study 1: b = -0.13, P = 0.538, 95% CI = (-0.54, 0.28) 

Study 2: b = -0.17, P = 0.295, 95% CI = (-0.49, 0.14) 

Study 3: b = -0.06, P = 0.656, 95% CI = (-0.50, 0.11) 

Collective Outrage (High vs. Low Overperception Newsfeed):

Study 4: mean(high) = 5.82 vs. mean(low) = 3.53; t(479.50) = 21.56, P < 0.001, Cohen's d = 1.90, 95% CI = (2.09, 2.50) 

Outrage Norms (High vs. Low Overperception Newsfeed):

Study 5: t(964.58) = -6.89, P < 0.001, d = 0.43, 95% CI = (0.47, 0.85) 

Affective Polarization (High vs. Low Overperception Newsfeed):

Study 5: Significant interaction F(1, 1,010) = 369.58, P < 0.001, η²p = 0.27. Ingroup liking: M(high) = 75.07 vs. M(low) = 56.12, P < 0.001. Outgroup dislike: M(high) = 15.64 vs. M(low) = 48.23, P < 0.001. 

Ideological Extremity (High vs. Low Overperception Newsfeed): 

Study 5: M(high) = 1.89 vs. M(low) = 1.34; t(1003.60) = -11.39, P < 0.001, d = 0.72, 95% CI = (0.46, 0.64)","This analysis revealed consistent evidence for overperception of outrage: observers reported perceiving higher levels of outrage than reported by message authors in study 1 (slope coefficient (b) = 0.59, P = 0.011, 95% confidence interval (CI) = (0.14, 1.04)) and study 2 (b = 0.58, P = 0.001, 95% CI = (0.25, 0.92)) (Fig. 2). While we observed consistent overperception of outrage, we did not observe overperception of happiness in study 1 (b = −0.13, P = 0.538, 95% CI = (−0.54, 0.28)) nor study 2 (b = −0.17, P = 0.295, 95% CI = (−0.49, 0.14)). Study 3 replicated the main overperception finding, with observers perceiving more outrage than was reported by authors, b = 0.62, P < 0.001, 95% CI = (0.27, 0.93). As expected, participants in the high-overperception newsfeed condition judged the collective outrage of their social network to be significantly greater (mean (M) = 5.82) than participants in low-overperception newsfeed condition (M = 3.53), t(479.50) = 21.56, P < 0.001, Cohen's d = 1.90, 95% CI = (2.09, 2.50) (Fig. 5). We found that participants exposed to the high-overperception newsfeed judged tweets that expressed outrage as more socially appropriate (relative to more neutral tweets) than participants who were exposed to the low-overperception newsfeed, t(964.58) = −6.89, P < 0.001, d = 0.43, 95% CI = (0.47, 0.85) (Fig. 5; Methods). As revealed by a significant interaction between newsfeed condition and group, F(1, 1,010) = 369.58, P < 0.001, η²p = 0.27, participants assigned to view the high-overperception newsfeed judged their network to like the political ingroup more (Mingroup = 75.07) compared to those who viewed the low-overperception newsfeed (Mingroup = 56.12), P < 0.001. Participants assigned to view the high-overperception newsfeed also judged that their network disliked the political outgroup more (Moutgroup = 15.64) than those who viewed the low-overperception newsfeed (Moutgroup = 48.23), P < 0.001. We found that participants who viewed the high-overperception newsfeed judged their network to be more ideologically extreme (M = 1.89) than did participants who viewed the low-overperception newsfeed (M = 1.34, t(1003.60) = −11.39, P < 0.001, d = 0.72, 95% CI = (0.46, 0.64)).","A priori power analyses were conducted for the experiments, but specific details (e.g., target effect size, power level) are not reported in the main text or appendix.","We used convenience sampling based on identifying specific types of social media users. Sample sizes for the field studies was based on a feasibility, sample size for our experiments was based on a priori power analyses.","The study tested for moderation by observers' daily political social media use, observers' ideological extremity, observers' partisan identity strength, and author partisanship.","As an exploratory analysis, we combined data from studies 1 and 2 to test whether observers' tendency to overperceive outrage was associated with their amount of daily social media use to learn about politics (political social media use). Multiple regression analyses revealed that political social media use was a significant predictor of overperception of outrage when statistically adjusting for observers' ideological extremity, partisan identity strength and tendency to overperceive happiness (Supplementary Section 1.3). For exploratory analyses that disentangle author versus observer effects in the overperception finding and that examine partisanship differences see Supplementary Sections 1.3, 1.6 and 1.7.","Test/Interaction: Pearson correlation between observer-level overperception of outrage and daily political social media use.

Result: Observers' overperception of outrage was positively correlated with their political social media use. For studies 1 & 2 combined, r(222) = 0.19, P = 0.004, 95% CI = (0.06, 0.31). For study 3, r(248) = 0.20, P = 0.001, 95% CI = (0.08, 0.32). This remained significant after controlling for ideological extremity and partisan identity strength. 

Test/Interaction: Interaction between source of judgment (author vs observer) and author partisanship (Democrat vs. Republican) on outrage ratings. 

Result: In Study 1, there was no significant interaction (b = 0.04, p = .793). In Studies 2 and 3, there was a significant interaction where Republican authors were overperceived more than Democrat authors (Study 2: b = 0.53, p < .001; Study 3: b = 0.64, p < .001). 

Test/Interaction: Correlation between observer-level overperception of outrage and observer ideological extremity. 

Result: No significant relationship across Studies 1-3, r(582) = .02, p = .555. 

Test/Interaction: Correlation between observer-level overperception of outrage and observer partisan identity strength. 

Result: No significant relationship across Studies 1-3, r(582) = .05, p = .260.","we found a significant positive correlation between overperception of outrage and political social media use (r(222) = 0.19, P = 0.004, 95% CI = (0.06, 0.31)). Multiple regression analyses revealed that political social media use was a significant predictor of overperception of outrage when statistically adjusting for observers' ideological extremity, partisan identity strength and tendency to overperceive happiness (Supplementary Section 1.3). Study 3 also replicated the association between overperception of outrage and political social media use, r(248) = 0.20, P = 0.001, 95% CI = (0.08, 0.32). In Study 1, we found no evidence that author partisanship interacted with the overperception estimate, b = 0.04, p = .793. In Studies 2 and 3 (which used the same author targets), a significant interaction found that Republican message authors were overperceived more than Democrat message authors, Study 2: b = 0.53, p <.001; Study 3: b = 0.64, p <.001. Examining data across Studies 1-3, we observed no significant relationship between ideological extremity of observers and their magnitude of overperception, r(582) = .02, p = .555. There was also no relationship between partisan identity strength and their magnitude of overperception of outrage, r(582) = .05, p = .260.","Age Description: Study 4: M = 35.61, SD = 13.33. Study 5: M = 36.95, SD = 13.94. 

Gender Description: Study 4: 55% Female. Study 5: 52% Female. 

Political Partisanship Description: Observer and experiment participants were recruited from Prolific.ac and identified as Republicans or Democrats. The authors aimed to have tweets rated by at least 10 Democrats and 10 Republicans in the observer phase. The experiments recruited approximately equal numbers of Democrats and Republicans.","Study 4 age: M = 35.61, SD = 13.33; 55% Female; Study 5 age: M = 36.95, SD = 13.94, 52% Female.","Authors in Studies 1-2 were recruited directly from Twitter after being identified via the Twitter API. 

Observers in Studies 1-3 and all participants in Studies 4-5 were recruited from the online platform Prolific.ac.",The sample for the field studies consists of U.S. Twitter users who discussed politics. Our experiments use partisan social media users recruited from Prolific.ac.,"Study 1: 133 authors, 110 observers; 

Study 2: 200 authors, 190 observers; 

Study 3: 350 observers; 

Study 4: 523;

 Study 5: 1,013","The first field study (N = 133 authors, N = 110 observers) was conducted in July and August 2020 and examined tweets discussing the William Barr Congressional hearing as well as President Trump’s favourability. The second preregistered, confirmatory field study (N = 200 authors, N = 190 observers) was conducted in October 2020 and examined tweets discussing the Amy Coney Barrett Supreme Court confirmation and the 2020 US Presidential election (Methods). ... In study 3, we carried out the observer phase only and recruited a larger number of participants (N = 350) to make judgements about the author-phase tweets from study 2. ... For the preregistered experiment, we randomly assigned participants (N = 600)...our final N was 523. For study 5, we conducted a preregistered experiment (N = 1,200)...our final N = 1,013.",United States,High political polarization; partisan social media use,2020 U.S. election cycle and related controversies,Twitter; simulated Twitter newsfeeds; algorithmic prominence of evocative content noted,Data: Jul–Oct 2020 (Studies 1–2); Nov 2020 (Study 3); Dec 2020 (Study 5); Mar 2021 (Study 4),"Platform features driving overperception; network structure (homophily, friendship paradox); other emotions; cross-platform tests",Authors contacted via open DMs (selection acknowledged); robustness checks suggest findings not driven by contactability,"Overperceived outrage inflates perceived norms, polarization, and extremity; informing users about algorithmic and perceptual biases may reduce misperceived hostility",,,,,,,,,,,,,
